{
  "$schema": "http://json-schema.org/draft-04/schema#",
  "description": "An instance record",
  "javaType": "org.folio.rest.jaxrs.model.Instance",
  "type": "object",
  "properties": {
    "id": {
      "type": "string",
      "description": "The unique ID of the instance record; a UUID",
      "$ref": "../common/uuid.json"
    },
    "_version": {
      "type": "integer",
      "description": "Record version for optimistic locking"
    },
    "hrid": {
      "type": "string",
      "description": "The human readable ID, also called eye readable ID. A system-assigned sequential ID which maps to the Instance ID"
    },
    "matchKey": {
      "type": "string",
      "description": "A unique instance identifier matching a client-side bibliographic record identification scheme, in particular for a scenario where multiple separate catalogs with no shared record identifiers contribute to the same Instance in Inventory. A match key is typically generated from select, normalized pieces of metadata in bibliographic records"
    },
    "sourceUri": {
      "type": "string",
      "description": "A remote URI uniquely identifying the source of the instance"
    },
    "source": {
      "type": "string",
      "description": "The metadata source and its format of the underlying record to the instance record. (e.g. FOLIO if it's a record created in Inventory; MARC if it's a MARC record created in MARCcat or EPKB if it's a record coming from eHoldings; CONSORTIUM-MARC or CONSORTIUM-FOLIO for sharing Instances)."
    },
    "title": {
      "type": "string",
      "description": "The primary title (or label) associated with the resource"
    },
    "indexTitle": {
      "type": "string",
      "description": "Title normalized for browsing and searching; based on the title with articles removed"
    },
    "alternativeTitles": {
      "type": "array",
      "description": "List of alternative titles for the resource (e.g. original language version title of a movie)",
      "items": {
        "type": "object",
        "javaType": "org.folio.rest.jaxrs.model.AlternativeTitle",
        "properties": {
          "alternativeTitleTypeId": {
            "type": "string",
            "description": "UUID for an alternative title qualifier",
            "$ref": "../common/uuid.json"
          },
          "alternativeTitle": {
            "type": "string",
            "description": "An alternative title for the resource"
          },
          "authorityId": {
            "type": "string",
            "description": "UUID of authority record that controls an alternative title",
            "$ref": "../common/uuid.json"
          }
        }
      },
      "uniqueItems": true
    },
    "editions": {
      "type": "array",
      "description": "The edition statement, imprint and other publication source information",
      "items": {
        "type": "string"
      },
      "uniqueItems": true
    },
    "series": {
      "type": "array",
      "description": "List of series titles associated with the resource (e.g. Harry Potter)",
      "items": {
        "type": "object",
        "javaType": "org.folio.rest.jaxrs.model.SeriesItem",
        "properties": {
          "value": {
            "type": "string",
            "description": "Series title value"
          },
          "authorityId": {
            "type": "string",
            "description": "UUID of authority record that controls an series title",
            "$ref": "../common/uuid.json"
          }
        },
        "additionalProperties": false,
        "required": [
          "value"
        ]
      },
      "uniqueItems": true
    },
    "identifiers": {
      "type": "array",
      "description": "An extensible set of name-value pairs of identifiers associated with the resource",
      "minItems": 0,
      "items": {
        "type": "object",
        "javaType": "org.folio.rest.jaxrs.model.Identifier",
        "properties": {
          "value": {
            "type": "string",
            "description": "Resource identifier value"
          },
          "identifierTypeId": {
            "type": "string",
            "description": "UUID of resource identifier type (e.g. ISBN, ISSN, LCCN, CODEN, Locally defined identifiers)",
            "$ref": "../common/uuid.json"
          },
          "identifierTypeObject": {
            "type": "object",
            "description": "Information about identifier type, looked up from identifierTypeId",
            "javaType": "org.folio.rest.jaxrs.model.IdentifierTypeVirtual",
            "folio:$ref": "illpolicy.json",
            "readonly": true,
            "folio:isVirtual": true,
            "folio:linkBase": "identifier-types",
            "folio:linkFromField": "identifierTypeId",
            "folio:linkToField": "id",
            "folio:includedElement": "identifierTypes.0"
          }
        },
        "additionalProperties": false,
        "required": [
          "value",
          "identifierTypeId"
        ]
      }
    },
    "contributors": {
      "type": "array",
      "description": "List of contributors",
      "minItems": 0,
      "items": {
        "type": "object",
        "javaType": "org.folio.rest.jaxrs.model.Contributor",
        "properties": {
          "name": {
            "type": "string",
            "description": "Personal name, corporate name, meeting name"
          },
          "contributorTypeId": {
            "type": "string",
            "description": "UUID for the contributor type term defined in controlled vocabulary",
            "$ref": "../common/uuid.json"
          },
          "contributorTypeText": {
            "type": "string",
            "description": "Free text element for adding contributor type terms other that defined by the MARC code list for relators"
          },
          "contributorNameTypeId": {
            "type": "string",
            "description": "UUID of contributor name type term defined by the MARC code list for relators",
            "$ref": "../common/uuid.json"
          },
          "authorityId": {
            "type": "string",
            "description": "UUID of authority record that controls the contributor",
            "$ref": "../common/uuid.json"
          },
          "contributorNameType": {
            "type": "object",
            "description": "Dereferenced contributor-name type",
            "javaType": "org.folio.rest.jaxrs.model.ContributorNameTypeVirtual",
            "folio:$ref": "contributornametype.json",
            "readonly": true,
            "folio:isVirtual": true,
            "folio:linkBase": "contributor-name-types",
            "folio:linkFromField": "contributorNameTypeId",
            "folio:linkToField": "id",
            "folio:includedElement": "contributorNameTypes.0"
          },
          "primary": {
            "type": "boolean",
            "description": "Whether this is the primary contributor"
          }
        },
        "additionalProperties": false,
        "required": [
          "name",
          "contributorNameTypeId"
        ]
      }
    },
    "subjects": {
      "type": "array",
      "description": "List of subject headings",
      "items": {
        "type": "object",
        "javaType": "org.folio.rest.jaxrs.model.Subject",
        "properties": {
          "value": {
            "type": "string",
            "description": "Subject heading value"
          },
          "authorityId": {
            "type": "string",
            "description": "UUID of authority record that controls a subject heading",
            "$ref": "../common/uuid.json"
          },
          "sourceId": {
            "type": "string",
            "description": "UUID of subject source",
            "$ref": "../common/uuid.json"
          },
          "typeId": {
            "type": "string",
            "description": "UUID of subject type",
            "$ref": "../common/uuid.json"
          }
        },
        "additionalProperties": false,
        "required": [
          "value"
        ]
      },
      "uniqueItems": true
    },
    "classifications": {
      "type": "array",
      "description": "List of classifications",
      "minItems": 0,
      "items": {
        "type": "object",
        "javaType": "org.folio.rest.jaxrs.model.Classification",
        "properties": {
          "classificationNumber": {
            "type": "string",
            "description": "Classification (e.g. classification scheme, classification schedule)"
          },
          "classificationTypeId": {
            "type": "string",
            "description": "UUID of classification schema (e.g. LC, Canadian Classification, NLM, National Agricultural Library, UDC, and Dewey)",
            "$ref": "../common/uuid.json"
          },
          "classificationType": {
            "type": "object",
            "description": "Dereferenced classification schema",
            "javaType": "org.folio.rest.jaxrs.model.ClassificationTypeVirtual",
            "folio:$ref": "classificationtype.json",
            "readonly": true,
            "folio:isVirtual": true,
            "folio:linkBase": "classification-types",
            "folio:linkFromField": "classificationTypeId",
            "folio:linkToField": "id",
            "folio:includedElement": "classificationTypes.0"
          }
        },
        "additionalProperties": false,
        "required": [
          "classificationNumber",
          "classificationTypeId"
        ]
      }
    },
    "publication": {
      "type": "array",
      "description": "List of publication items",
      "items": {
        "type": "object",
        "javaType": "org.folio.rest.jaxrs.model.PublicationItem",
        "properties": {
          "publisher": {
            "type": "string",
            "description": "Name of publisher, distributor, etc."
          },
          "place": {
            "type": "string",
            "description": "Place of publication, distribution, etc."
          },
          "dateOfPublication": {
            "type": "string",
            "description": "Date (year YYYY) of publication, distribution, etc."
          },
          "role": {
            "type": "string",
            "description": "The role of the publisher, distributor, etc."
          }
        }
      }
    },
    "publicationFrequency": {
      "type": "array",
      "description": "List of intervals at which a serial appears (e.g. daily, weekly, monthly, quarterly, etc.)",
      "items": {
        "type": "string"
      },
      "uniqueItems": true
    },
    "publicationRange": {
      "type": "array",
      "description": "The range of sequential designation/chronology of publication, or date range",
      "items": {
        "type": "string"
      },
      "uniqueItems": true
    },
    "electronicAccess": {
      "type": "array",
      "description": "List of electronic access items",
      "items": {
        "type": "object",
        "$ref": "../common/electronicAccessItem.json"
      }
    },
    "dates": {
      "type": "object",
      "description": "Instance Dates",
      "javaType": "org.folio.rest.jaxrs.model.InstanceDates",
      "properties": {
        "dateTypeId": {
          "type": "string",
          "description": "Date type ID",
          "$ref": "../common/uuid.json"
        },
        "date1": {
          "type": "string",
          "description": "Date 1",
          "maxLength": 4
        },
        "date2": {
          "type": "string",
          "description": "Date 2",
          "maxLength": 4
        }
      },
      "additionalProperties": false
    },
    "instanceTypeId": {
      "type": "string",
      "description": "UUID of the unique term for the resource type whether it's from the RDA content term list of locally defined",
      "$ref": "../common/uuid.json"
    },
    "instanceFormatIds": {
      "type": "array",
      "description": "UUIDs for the unique terms for the format whether it's from the RDA carrier term list of locally defined",
      "items": {
        "type": "string",
        "$ref": "../common/uuid.json"
      }
    },
    "instanceFormats": {
      "type": "array",
      "description": "List of dereferenced instance formats",
      "items": {
        "type": "object",
        "$ref": "../instance-formats/instanceformat.json"
      },
      "readonly": true,
      "folio:isVirtual": true,
      "folio:linkBase": "instance-formats",
      "folio:linkFromField": "instanceFormatIds",
      "folio:linkToField": "id",
      "folio:includedElement": "instanceFormats"
    },
    "physicalDescriptions": {
      "type": "array",
      "description": "Physical description of the described resource, including its extent, dimensions, and such other physical details as a description of any accompanying materials and unit type and size",
      "items": {
        "type": "string"
      }
    },
    "languages": {
      "type": "array",
      "description": "The set of languages used by the resource",
      "minItems": 0,
      "items": {
        "type": "string"
      }
    },
    "notes": {
      "type": "array",
      "description": "Bibliographic notes (e.g. general notes, specialized notes)",
      "items": {
        "type": "object",
        "javaType": "org.folio.rest.jaxrs.model.InstanceNote",
        "additionalProperties": false,
        "properties": {
          "instanceNoteTypeId": {
            "description": "ID of the type of note",
            "$ref": "../common/uuid.json"
          },
          "note": {
            "type": "string",
            "description": "Text content of the note"
          },
          "staffOnly": {
            "type": "boolean",
            "description": "If true, determines that the note should not be visible for others than staff",
            "default": false
          }
        }
      }
    },
    "administrativeNotes": {
      "type": "array",
      "description": "Administrative notes",
      "minItems": 0,
      "items": {
        "type": "string"
      }
    },
    "modeOfIssuanceId": {
      "type": "string",
      "description": "UUID of the RDA mode of issuance, a categorization reflecting whether a resource is issued in one or more parts, the way it is updated, and whether its termination is predetermined or not (e.g. monograph,  sequential monograph, serial; integrating Resource, other)",
      "$ref": "../common/uuid.json"
    },
    "catalogedDate": {
      "type": "string",
      "description": "Date or timestamp on an instance for when is was considered cataloged"
    },
    "previouslyHeld": {
      "type": "boolean",
      "description": "Records the fact that the resource was previously held by the library for things like Hathi access, etc.",
      "default": false
    },
    "staffSuppress": {
      "type": "boolean",
      "description": "Records the fact that the record should not be displayed for others than catalogers"
    },
    "discoverySuppress": {
      "type": "boolean",
      "description": "Records the fact that the record should not be displayed in a discovery system",
      "default": false
    },
    "deleted": {
      "type": "boolean",
      "description": "Indicates whether the record was marked for deletion",
      "default": false
    },
    "statisticalCodeIds": {
      "type": "array",
      "description": "List of statistical code IDs",
      "items": {
        "type": "string"
      },
      "uniqueItems": true
    },
    "sourceRecordFormat": {
      "type": "string",
      "description": "Format of the instance source record, if a source record exists (e.g. FOLIO if it's a record created in Inventory,  MARC if it's a MARC record created in MARCcat or EPKB if it's a record coming from eHoldings)",
      "enum": [
        "MARC-JSON"
      ],
      "readonly": true
    },
    "statusId": {
      "type": "string",
      "description": "UUID for the Instance status term (e.g. cataloged, uncatalogued, batch loaded, temporary, other, not yet assigned)",
      "$ref": "../common/uuid.json"
    },
    "statusUpdatedDate": {
      "type": "string",
      "description": "Date [or timestamp] for when the instance status was updated"
    },
    "tags": {
      "description": "arbitrary tags associated with this instance",
      "id": "tags",
      "type": "object",
      "$ref": "../../raml-util/schemas/tags.schema"
    },
    "metadata": {
      "type": "object",
      "$ref": "../../raml-util/schemas/metadata.schema",
      "readonly": true
    },
    "holdingsRecords2": {
      "type": "array",
      "description": "List of holdings records",
      "items": {
        "type": "object",
        "$ref": "../holdings-storage/holdingsRecord.json"
      },
      "readonly": true,
      "folio:isVirtual": true,
      "folio:linkBase": "holdings-storage/holdings",
      "folio:linkFromField": "id",
      "folio:linkToField": "instanceId",
      "folio:includedElement": "holdingsRecords"
    },
    "natureOfContentTermIds": {
      "type": "array",
      "description": "Array of UUID for the Instance nature of content (e.g. bibliography, biography, exhibition catalogue, festschrift, newspaper, proceedings, research report, thesis or website)",
      "uniqueItems": true,
      "items": {
        "type": "string",
        "description": "Single UUID for the Instance nature of content",
        "$ref": "../common/uuid.json"
      }
    }
  },
  "additionalProperties": false,
  "required": [
    "source",
    "title",
    "instanceTypeId"
  ]
}
