{
  "id": "6506b79b-7702-48b2-9774-a1c538fdd34e",
  "source": "MARC",
  "title": "Nod",
  "contributors": [
    {
      "contributorNameTypeId": "2b94c631-fca9-4892-a730-03ee529ffe2a",
      "name": "Barnes, Adrian"
    }
  ],
  "identifiers": [
    {
      "identifierTypeId": "8261054f-be78-422d-bd51-4ed9f33c3422",
      "value": "0956687695"
    },
    {
      "identifierTypeId": "8261054f-be78-422d-bd51-4ed9f33c3422",
      "value": "9780956687695"
    }
  ],
  "instanceTypeId": "6312d172-f0cf-40f6-b27d-9fa8feaf332f"
}
