{
  "id": "54cc0262-76df-4cac-acca-b10e9bc5c79a",
  "source": "MARC",
  "title": "On the signature of complex system a decomposed approach Gaofeng Da, Ping Shing Chan, Maochao Xu",
  "alternativeTitles": [],
  "series": [],
  "identifiers": [
    {
      "value": "1011184508",
      "identifierTypeId": "5d164f4b-0b15-4e42-ae75-cfcf85318ad9"
    },
    {
      "value": "(DE-599)GBV1011184508",
      "identifierTypeId": "7e591197-f335-4afb-bc6d-a6d76ca3bace"
    }
  ],
  "contributors": [
    {
      "contributorNameTypeId": "2b94c631-fca9-4892-a730-03ee529ffe2a",
      "name": "Da, Gaofeng"
    },
    {
      "contributorNameTypeId": "2b94c631-fca9-4892-a730-03ee529ffe2a",
      "name": "Chan, Ping Shing"
    },
    {
      "contributorNameTypeId": "2b94c631-fca9-4892-a730-03ee529ffe2a",
      "name": "Xu, Maochao"
    }
  ],
  "subjects": [],
  "classifications": [],
  "publication": [],
  "instanceTypeId": "6312d172-f0cf-40f6-b27d-9fa8feaf332f",
  "physicalDescriptions": [],
  "languages": [
    "eng"
  ],
  "notes": []
}
