{
  "id" : "858b9600-bd76-44ff-a83e-f82dcf5ed12b",
  "hrid" : "bwinst0005",
  "source" : "FOLIO",
  "title" : "Magazine - Q2",
  "identifiers" : [ {
    "identifierTypeId" : "2e8b3b6c-0e7d-4e48-bca2-b0b23b376af5",
    "value" : "bw"
  } ],
  "instanceTypeId" : "6312d172-f0cf-40f6-b27d-9fa8feaf332f",
  "previouslyHeld" : false,
  "staffSuppress" : false,
  "discoverySuppress" : false,
  "statusUpdatedDate" : "2022-10-12T13:04:17.905+0000"
}
